dokumen,0.05,0.1,0.2,0.3
Sebanyak lima negara akan meminjamkan pesawat Hercules C-130 guna memudahkan penanganan bencana gempa dan tsunami di Sulawesi Tengah.,yes,yes,yes,yes
"Menteri Koordinator Bidang Politik Hukum dan Keamanan Wiranto mengatakan negara yang bersedia mengirimkan pesawat C130, yakni Singapura, Malaysia, India, Korea Selatan, dan Amerika Serikat.",yes,yes,yes,yes
"""Kita minta bantuan pesawat C130.",no,no,no,no
Pesawat jenis itu yang bisa mendarat dan take off.,no,no,no,no
"Jumlah pesawat C130 kita terbatas,"" ujar Wiranto dalam jumpa pers di Jakarta, Selasa (2/10).",no,no,no,no
"Dengan kondisi Bandara Mutiara Sis-Al Jufri di Palu, pesawat Hercules C-130 memang ideal karena bobotnya berat dan bisa mendarat dan lepas landas di landasan pacu yang pendek.",no,no,no,no
"Bandara Mutiara Sis-Al Jufri sejatinya memiliki landasan pacu sepanjang 2.500 meter, namun hanya 2.000 meter yang bisa digunakan lantaran sisanya rusak akibat gempa.",no,no,no,no
"Wiranto menambahkan, pesawat angkut tersebut akan mengangkut bantuan dari Balikpapan dan Makassar ke Palu.",no,no,no,no
Gempa dan tsunami yang melanda Palu dan sejumlah daerah lainnya di Sulawesi Tengah membuat berbagai negara menyampaikan duka cita sekaligus tawaran bantuan.,no,yes,yes,yes
Pemerintah Indonesia memutuskan untuk menerima tawaran tersebut.,no,no,no,no
"Keputusan pemerintah Indonesia menerima bantuan internasional dicuitkan Thomas Lembong, Kepala Badan Koordinasi Penanaman Modal, pada Senin (1/10).",no,no,no,no
"""Tadi malam, Presiden Jokowi memberi persetujuan kepada kami untuk menerima bantuan internasional untuk penanganan darurat bencana.",no,no,no,no
Saya membantu mengoordinasikan bantuan sektor swasta dari seantero dunia.,no,no,no,no
"Mohon kirimkan pesan kepada saya melalui akun media sosial atau email: tom@bkpm.go.id,"" sebutnya.",no,no,no,no
"Secara terpisah, juru bicara Badan Nasional Penanggulangan Bencana (BNPB), Sutopo Purwo Nugroho, menyatakan telah menghubungi Menteri Luar Negeri Retno Marsudi yang tengah berada di New York, AS.",no,no,no,no
"""Beliau mengatakan bahwa Presiden telah menyatakan menerima bantuan internasional sesuai kebutuhan kita.",no,no,no,no
"Artinya kita ""welcome"" dengan tawaran internasional.",no,no,no,no
Nanti akan dikoordinir Menkopolhukam.,no,no,no,no
"Mekanisme dan prosedur sedang disiapkan BNPB dan Kemenlu sesuai dengan peraturan yang ada,"" sebut Sutopo.",no,no,no,no
"""Declare bantuan internasional itu tidak harus status bencana nasional.",no,no,no,no
Presiden tidak mendeclare status bencana nasional.,no,no,no,no
"Jadi gempa dan stunami di Sulteng bukan bencana nasional,"" sambungnya.",no,no,no,no
"Dalam jumpa pers di Jakarta, Senin (1/10), Sutopo mengatakan Indoensia menyambut bantuan berupa, antara lain alat angkut untuk landasan pacu 2.000 meter, tenda pengungsl, perangkat pengolahan air bersih, rumah sakit lapangan, tenaga medis, dan genset.",no,yes,yes,yes
"Menurutnya, sudah ada 10 negara yang menyampaikan tawaran bantuan.",no,no,yes,yes
"Sebelumnya, berbagai ucapan simpati dan tawaran bantuan mengalir dari sejumlah pihak, seperti Australia, Cina, Amerika Serikat, Singapura, hingga Uni Eropa.",no,no,yes,yes
"Dalam pernyataan resminya yang dikutip ABC, Perdana Menteri Australia, Scott Morrison, mengaku telah menghubungi Presiden Joko Widodo untuk menyampaikan komitmennya dalam memberi dukungan.",no,no,yes,yes
"""Jika dia perlu bantuan kita, dia akan mendapatkannya,"" kata Morrison kepada ABC.",no,no,no,no
"""Mereka belum meminta apapun, namun Presiden sangat mengapresiasi empati warga Australia,"" sambungnya.",no,no,no,no
"Presiden Cina Xi Jinping mengucapkan belasungkawa kepada Presiden Republik Indonesia Joko Widodo atas bencana alam gempa bumi dan tsunami yang terjadi di Palu dan Donggala, Sulawesi Tengah.",no,no,yes,yes
"""Saya terkejut mendengar gempa bumi kuat dan tsunami yang besar menghantam Provinsi Sulawesi Tengah dan sedih dengan banyaknya nyawa yang hilang dan kerusakan yang terjadi,"" kata Xi seperti dilansir dari China Daily, Minggu (30/9).",no,no,no,no
Pemerintah Cina melalui Palang Merah mereka juga sudah memberikan bantuan sebesar US$200 ribu ke Palang Merah Indonesia.,no,no,no,yes
"Kemudian, pemerintah Amerika Serikat (AS), melalui Duta Besar untuk Republik Indonesia di Jakarta, menyatakan siap memberikan bantuan.",no,no,no,no
"Melalui keterangan resmi dari Kedutaan Besar AS di Jakarta, Dubes Joseph Donovan menyampaikan ""belasungkawa kepada keluarga dan masyarakat yang terkena dampak gempa bumi dan tsunami di Sulawesi Tengah.""",no,no,no,yes
"""Saya telah menghubungi Menteri Luar Negeri RI Retno Marsudi untuk menyampaikan belasungkawa dan menawarkan bantuan kami.""",no,no,no,no
"""Indonesia adalah mitra penting, dan kami siap bekerja sama untuk memberikan dukungan kepada mereka yang membutuhkan.""",no,no,no,no
"Lebih jauh, Kedutaan Besar AS di Jakarta menyatakan Badan Bantuan Bencana Asing (OFDA) memiliki beragam opsi untuk bantuan kemanusiaan.",no,no,no,yes
"""Pertama, kami akan bekerja sama dengan pemrintah Indonesia guna mengidentifikasi apa yang saat ini dibutuhkan dan kemudian menentukan posisi terbaik Amerika Serikat dan mitra-mitranya dalam memenuhi berbagai kebutuhan ini.",no,no,no,no
"""Kami akan berkoordinasi dengan pemerintah Indonesia dan mitra-mitra kami untuk memastikan bantuan didasari kebutuhan dan layak.",no,no,no,no
"""Beberapa opsi meliputi pengiriman barang bantuan dari gudang pemerintah AS di seluruh dunia, dana bantuan kepada organisasi mitra untuk menjalankan aktivitas kemanusiaan, dan mengerahkan penasihat teknis,"" sebut Kedutaan Besar AS di Jakarta.",no,no,no,yes
"Sementara itu, Uni Eropa telah mengumumkan bakal mengucurkan 1,5 juta euro (Rp25 miliar) dalam bantuan langsung.",no,no,no,no
